{
  "observation_contract_version": "1.0",
  "observation_id": "obs_aaaaaaaaaaaaaaaaaaaaaaaaaa",
  "idempotency_token": "idem_abcdefghijklmnopqrstuvwx",
  "phase": "observe",
  "provider": "gamelift",
  "capability": {
    "capability_id": "gamelift.observe-fleet",
    "capability_version": "1.0"
  },
  "effective_authority": "observe",
  "authority_inputs": {
    "deployment_mode": "observe",
    "tenant_policy": "remediate",
    "workspace_policy": "advise",
    "principal_authority": "observe",
    "capability_maximum": "observe",
    "risk_policy": "remediate"
  },
  "requester": {
    "subject_id": "subject.operator-1",
    "client_id": "client.web-console",
    "tenant_id": "tenant.default",
    "workspace_id": "workspace.default"
  },
  "correlation": {
    "correlation_id": "corr.observe-1",
    "request_id": "request.observe-1"
  },
  "target": {
    "provider": "gamelift",
    "fleet_id": "fleet-1234abcd-5678-90ef-a1b2-c3d4e5f60789"
  },
  "observed_at": "2026-09-21T19:11:52Z",
  "expires_at": "2026-09-21T19:41:52Z",
  "results": {
    "utilization": {
      "active_server_processes": 12,
      "active_game_sessions": 8,
      "current_player_sessions": 30,
      "maximum_player_sessions": 100
    },
    "capacity": [
      {
        "location": "us-west-2",
        "desired": 10,
        "minimum": 2,
        "maximum": 20,
        "active": 10,
        "idle": 2
      },
      {
        "location": "eu-west-1",
        "desired": 4,
        "minimum": 1,
        "maximum": 8,
        "active": 4,
        "idle": 1
      }
    ],
    "scaling_policies": [
      {
        "name": "target-utilization",
        "status": "ACTIVE",
        "metric_name": "PercentAvailableGameSessions"
      }
    ]
  }
}
